{
  "ot_version": "0.1",
  "trajectory_id": "conformance-harness-antigravity",
  "harness": { "name": "antigravity", "version": "0.x" },
  "task": { "description": "Run a shell command (Antigravity CLI shape: typed log items, run_shell_command, token usage)." },
  "model": "gemini-2.5-pro",
  "steps": [
    { "index": 0, "role": "user", "message": { "text": "Read config.ts and run the tests." } },
    {
      "index": 1,
      "role": "assistant",
      "tool_call": { "id": "g1", "name": "run_shell_command", "args": { "command": "npm test" }, "result": "Tests: 12 passed, 12 total", "success": true }
    }
  ],
  "outcome": { "status": "success", "resolved": true },
  "cost": { "input_tokens": 150, "output_tokens": 30 }
}
